[
  {
    "schema_version": "0.1-draft",
    "id": "evt_01J9K2A0P001",
    "idempotency_key": "seed-spring-spin-001",
    "type": "problem.reported",
    "time": "2026-03-09T14:00:00Z",
    "actor": {
      "kind": "human",
      "id": "user:t.nguyen"
    },
    "subject": {
      "system": "support-desk",
      "component": "inbox"
    },
    "summary": "New visitors keep asking support for a first-order offer; seven tickets this week",
    "sources": [
      {
        "kind": "ticket",
        "ref": "SUP-790"
      }
    ],
    "evidence": [
      {
        "kind": "ticket.cluster",
        "ref": "support://clusters/first-order-offer"
      }
    ],
    "provenance": {
      "recorded_by": "user:t.nguyen",
      "method": "human_entered"
    }
  },
  {
    "schema_version": "0.1-draft",
    "id": "evt_01J9K2A0P002",
    "idempotency_key": "seed-spring-spin-002",
    "type": "problem.reported",
    "time": "2026-03-10T09:00:00Z",
    "actor": {
      "kind": "human",
      "id": "user:l.berg"
    },
    "subject": {
      "system": "spring-spin",
      "component": "campaign"
    },
    "summary": "New-client sign-ups have been flat for three weeks; request a seasonal offer that turns first visits into registrations",
    "sources": [
      {
        "kind": "ticket",
        "ref": "MKT-310"
      }
    ],
    "evidence": [
      {
        "kind": "dashboard",
        "ref": "analytics://signups/weekly"
      }
    ],
    "links": [
      {
        "rel": "relates_to",
        "target": "evt_01J9K2A0P001",
        "basis": "confirmed"
      }
    ],
    "provenance": {
      "recorded_by": "user:l.berg",
      "method": "human_entered"
    }
  },
  {
    "schema_version": "0.1-draft",
    "id": "evt_01J9K2A0P003",
    "idempotency_key": "seed-spring-spin-003",
    "type": "investigation.completed",
    "time": "2026-03-10T10:20:00Z",
    "actor": {
      "kind": "ai_agent",
      "id": "agent:research-assistant",
      "on_behalf_of": "user:a.novak"
    },
    "subject": {
      "system": "promo-api",
      "component": "discounts"
    },
    "summary": "A discount game is feasible on the existing checkout; risks are code stacking with current promotions and repeated spins by one person",
    "evidence": [
      {
        "kind": "code.ref",
        "ref": "promo-api@main:discounts/stacking.go#L41"
      },
      {
        "kind": "doc",
        "ref": "wiki://promo/stacking-rules"
      }
    ],
    "links": [
      {
        "rel": "investigates",
        "target": "evt_01J9K2A0P002",
        "basis": "confirmed"
      }
    ],
    "provenance": {
      "recorded_by": "agent:research-assistant",
      "method": "agent_submitted",
      "confidence": "asserted"
    }
  },
  {
    "schema_version": "0.1-draft",
    "id": "evt_01J9K2A0P004",
    "idempotency_key": "seed-spring-spin-004",
    "type": "proposal.recorded",
    "time": "2026-03-10T11:30:00Z",
    "actor": {
      "kind": "ai_agent",
      "id": "agent:code-assistant",
      "on_behalf_of": "user:a.novak"
    },
    "subject": {
      "system": "promo-api",
      "component": "spin-service"
    },
    "summary": "Spin-to-win: one spin per new account, server-side draw, discount capped at 20%, never stacked with other promotions",
    "links": [
      {
        "rel": "motivated_by",
        "target": "evt_01J9K2A0P002",
        "basis": "confirmed"
      },
      {
        "rel": "relates_to",
        "target": "evt_01J9K2A0P003",
        "basis": "confirmed"
      }
    ],
    "provenance": {
      "recorded_by": "agent:code-assistant",
      "method": "agent_submitted",
      "confidence": "asserted"
    },
    "extensions": {
      "org.techlog.proposal": {
        "alternatives_considered": [
          {
            "option": "Client-side draw",
            "rejected_because": "the result could be tampered with"
          },
          {
            "option": "Unlimited spins",
            "rejected_because": "invites abuse and deep discounts"
          }
        ]
      }
    }
  },
  {
    "schema_version": "0.1-draft",
    "id": "evt_01J9K2A0P005",
    "idempotency_key": "seed-spring-spin-005",
    "type": "decision.made",
    "time": "2026-03-10T15:00:00Z",
    "actor": {
      "kind": "human",
      "id": "user:l.berg"
    },
    "subject": {
      "system": "spring-spin",
      "component": "campaign"
    },
    "summary": "Approved with finance: 20% cap, two-week window, new accounts only",
    "evidence": [
      {
        "kind": "approval",
        "ref": "approval://appr_5120"
      }
    ],
    "links": [
      {
        "rel": "decides",
        "target": "evt_01J9K2A0P004",
        "basis": "confirmed"
      }
    ],
    "provenance": {
      "recorded_by": "user:l.berg",
      "method": "human_entered"
    }
  },
  {
    "schema_version": "0.1-draft",
    "id": "evt_01J9K2A0P006",
    "idempotency_key": "seed-spring-spin-006",
    "type": "change.implemented",
    "time": "2026-03-11T10:12:00Z",
    "actor": {
      "kind": "ai_agent",
      "id": "agent:code-assistant",
      "on_behalf_of": "user:a.novak"
    },
    "subject": {
      "system": "promo-api",
      "component": "spin-service"
    },
    "summary": "Spin endpoint with server-side draw, 20% cap, and one spin per new account; reviewed and merged",
    "sources": [
      {
        "kind": "git.pr",
        "ref": "promo-api#412"
      },
      {
        "kind": "git.commit",
        "ref": "promo-api@9c3e7ab"
      }
    ],
    "links": [
      {
        "rel": "implements",
        "target": "evt_01J9K2A0P004",
        "basis": "confirmed"
      },
      {
        "rel": "relates_to",
        "target": "evt_01J9K2A0P005",
        "basis": "confirmed"
      }
    ],
    "provenance": {
      "recorded_by": "collector:git",
      "method": "collected"
    }
  },
  {
    "schema_version": "0.1-draft",
    "id": "evt_01J9K2A0P007",
    "idempotency_key": "seed-spring-spin-007",
    "type": "verification.completed",
    "time": "2026-03-11T11:05:00Z",
    "actor": {
      "kind": "system",
      "id": "ci:pipeline"
    },
    "subject": {
      "system": "promo-api",
      "component": "spin-service"
    },
    "summary": "Unit, integration, and abuse tests passed: repeat spins are rejected and the cap is enforced",
    "evidence": [
      {
        "kind": "test.report",
        "ref": "ci://run/90412",
        "digest": "sha256:7b1e4d9a2c6f08e35a9d1b7c4e2f6a8091d3c5b7e9f0a2c4d6e8b0a1c3e5f7d9"
      }
    ],
    "links": [
      {
        "rel": "verifies",
        "target": "evt_01J9K2A0P006",
        "basis": "confirmed"
      }
    ],
    "provenance": {
      "recorded_by": "collector:ci",
      "method": "collected"
    }
  },
  {
    "schema_version": "0.1-draft",
    "id": "evt_01J9K2A0P008",
    "idempotency_key": "seed-spring-spin-008",
    "type": "verification.completed",
    "time": "2026-03-11T16:40:00Z",
    "actor": {
      "kind": "system",
      "id": "loadtest:pipeline"
    },
    "subject": {
      "system": "promo-api",
      "environment": "staging"
    },
    "summary": "Load test at three times the expected spin volume: checkout latency stayed within budget",
    "evidence": [
      {
        "kind": "test.report",
        "ref": "ci://run/90431",
        "digest": "sha256:a41c8e07d3b9f256e0c4a7b18d5f3e92c60b4a9d7e1f8305c2b6d4e9a0f17c38"
      }
    ],
    "links": [
      {
        "rel": "verifies",
        "target": "evt_01J9K2A0P006",
        "basis": "confirmed"
      }
    ],
    "provenance": {
      "recorded_by": "collector:ci",
      "method": "collected"
    }
  },
  {
    "schema_version": "0.1-draft",
    "id": "evt_01J9K2A0P009",
    "idempotency_key": "seed-spring-spin-009",
    "type": "action.tracked",
    "time": "2026-03-12T10:30:00Z",
    "actor": {
      "kind": "human",
      "id": "user:t.nguyen"
    },
    "subject": {
      "system": "support-desk",
      "component": "inbox"
    },
    "summary": "Support briefed on the offer: answer macros are ready and the escalation path to on-call is agreed",
    "links": [
      {
        "rel": "relates_to",
        "target": "evt_01J9K2A0P005",
        "basis": "confirmed"
      }
    ],
    "provenance": {
      "recorded_by": "user:t.nguyen",
      "method": "human_entered"
    }
  },
  {
    "schema_version": "0.1-draft",
    "id": "evt_01J9K2A0P010",
    "idempotency_key": "seed-spring-spin-010",
    "type": "release.deployed",
    "time": "2026-03-12T13:20:00Z",
    "actor": {
      "kind": "system",
      "id": "deploy:pipeline"
    },
    "subject": {
      "system": "promo-api",
      "environment": "production"
    },
    "summary": "Version 3.8.0 released as a canary to 5% of traffic",
    "sources": [
      {
        "kind": "deploy",
        "ref": "deploy://promo-api/3.8.0/canary-1"
      }
    ],
    "links": [
      {
        "rel": "releases",
        "target": "evt_01J9K2A0P006",
        "basis": "confirmed"
      }
    ],
    "provenance": {
      "recorded_by": "collector:deploy",
      "method": "collected"
    }
  },
  {
    "schema_version": "0.1-draft",
    "id": "evt_01J9K2A0P011",
    "idempotency_key": "seed-spring-spin-011",
    "type": "incident.opened",
    "time": "2026-03-12T13:38:00Z",
    "actor": {
      "kind": "system",
      "id": "alert:error-rate-monitor"
    },
    "subject": {
      "system": "promo-api",
      "component": "spin-service",
      "environment": "production"
    },
    "summary": "5xx ratio on the spin endpoint reached 6.2% on the canary, above the 1.0% rollback threshold for 3 minutes",
    "evidence": [
      {
        "kind": "alert",
        "ref": "alert://promo-api/high-error-rate/a-5521"
      },
      {
        "kind": "metric.query",
        "ref": "metrics://promo-api/http_5xx_ratio?canary=true"
      }
    ],
    "links": [
      {
        "rel": "observed_after",
        "target": "evt_01J9K2A0P010",
        "basis": "confirmed"
      },
      {
        "rel": "caused_by",
        "target": "evt_01J9K2A0P006",